{
  "run_id": "artemis_run_20261029_075205_d79aea",
  "timestamp": "2026-10-29T07:52:05.886131+00:00",
  "mode": "candidate_eval",
  "runner_version": "artemis-runner/1.0",
  "execution_status": "completed",
  "not_executed_reason": null,
  "git_commit": "0ade4ad3fc9295e05de0e30f38cb060142c6fa39",
  "system_info": {
    "platform": "macOS-15.6.1-arm64-arm-64bit-Mach-O",
    "python_version": "3.13.5",
    "cpu_count": 8
  },
  "model_metadata": {
    "adapter_type": "recorded",
    "model_name": "recorded_recorded_responses_dev_20",
    "recorded_file": "recorded_responses_dev_20.json",
    "recorded_sha256": "6ed6029ada8e61ca6bcc7c278e2cfc0dbd2a96e7ec0bd47a650d3f73b3849cda",
    "total_records": 20
  },
  "benchmark_metadata": {
    "benchmark_file": "artemis_eval_dev_20.json",
    "benchmark_sha256": "c204497731b637d31da221a468ca2a4c2537d275a974234f41aefe7da4313c5f",
    "manifest_version": "artemis-manifest/1.1",
    "item_count": 20
  },
  "summary": {
    "total_cases": 20,
    "passed_cases": 18,
    "failed_cases": 2,
    "pass_rate": 0.9,
    "dimension_pass_rates": {
      "source_fidelity": 1.0,
      "citation_accuracy": 0.9,
      "procedural_integrity": 1.0,
      "abstention_appropriateness": 1.0
    },
    "dimension_failures": {
      "citation_accuracy": 2
    },
    "item_scores": [
      {
        "item_id": "ARTEMIS-004-DEV-001",
        "overall_passed": true,
        "primary_outcome": "correct",
        "dimension_scores": {
          "source_fidelity": {
            "dimension": "source_fidelity",
            "outcome": "correct",
            "passed": true,
            "failures": [],
            "details": {}
          },
          "citation_accuracy": {
            "dimension": "citation_accuracy",
            "outcome": "correct",
            "passed": true,
            "failures": [],
            "details": {
              "metric_scope": "citation_id_overlap_only",
              "precision": 1.0,
              "recall": 1.0,
              "citations": [
                "EV-DEV-001-A"
              ]
            }
          },
          "procedural_integrity": {
            "dimension": "procedural_integrity",
            "outcome": "correct",
            "passed": true,
            "failures": [],
            "details": {}
          },
          "abstention_appropriateness": {
            "dimension": "abstention_appropriateness",
            "outcome": "correct",
            "passed": true,
            "failures": [],
            "details": {
              "status": "answered",
              "should_withhold": false,
              "forbid_withholding": true
            }
          }
        },
        "all_failures": [],
        "flags": [
          "pending_human_review",
          "candidate_evaluation_only"
        ],
        "parsed_response": {
          "status": "answered",
          "answer": "공식 지침 및 출입국관리법령에 따른 안내입니다: 원칙적으로 제한 재외공관 사증",
          "citations": [
            "EV-DEV-001-A"
          ]
        },
        "is_official_gold": false
      },
      {
        "item_id": "ARTEMIS-004-DEV-002",
        "overall_passed": true,
        "primary_outcome": "correct",
        "dimension_scores": {
          "source_fidelity": {
            "dimension": "source_fidelity",
            "outcome": "correct",
            "passed": true,
            "failures": [],
            "details": {}
          },
          "citation_accuracy": {
            "dimension": "citation_accuracy",
            "outcome": "correct",
            "passed": true,
            "failures": [],
            "details": {
              "metric_scope": "citation_id_overlap_only",
              "precision": 1.0,
              "recall": 1.0,
              "citations": [
                "EV-DEV-002-A"
              ]
            }
          },
          "procedural_integrity": {
            "dimension": "procedural_integrity",
            "outcome": "correct",
            "passed": true,
            "failures": [],
            "details": {}
          },
          "abstention_appropriateness": {
            "dimension": "abstention_appropriateness",
            "outcome": "correct",
            "passed": true,
            "failures": [],
            "details": {
              "status": "answered",
              "should_withhold": false,
              "forbid_withholding": true
            }
          }
        },
        "all_failures": [],
        "flags": [
          "pending_human_review",
          "candidate_evaluation_only"
        ],
        "parsed_response": {
          "status": "answered",
          "answer": "공식 지침 및 출입국관리법령에 따른 안내입니다: 사증발급인정서 재외공관 체류기간 연장 대상 아님",
          "citations": [
            "EV-DEV-002-A"
          ]
        },
        "is_official_gold": false
      },
      {
        "item_id": "ARTEMIS-004-DEV-003",
        "overall_passed": true,
        "primary_outcome": "correct",
        "dimension_scores": {
          "source_fidelity": {
            "dimension": "source_fidelity",
            "outcome": "correct",
            "passed": true,
            "failures": [],
            "details": {}
          },
          "citation_accuracy": {
            "dimension": "citation_accuracy",
            "outcome": "correct",
            "passed": true,
            "failures": [],
            "details": {
              "metric_scope": "citation_id_overlap_only",
              "precision": 1.0,
              "recall": 1.0,
              "citations": [
                "EV-DEV-003-A"
              ]
            }
          },
          "procedural_integrity": {
            "dimension": "procedural_integrity",
            "outcome": "correct",
            "passed": true,
            "failures": [],
            "details": {}
          },
          "abstention_appropriateness": {
            "dimension": "abstention_appropriateness",
            "outcome": "correct",
            "passed": true,
            "failures": [],
            "details": {
              "status": "answered",
              "should_withhold": false,
              "forbid_withholding": true
            }
          }
        },
        "all_failures": [],
        "flags": [
          "pending_human_review",
          "candidate_evaluation_only"
        ],
        "parsed_response": {
          "status": "answered",
          "answer": "공식 지침 및 출입국관리법령에 따른 안내입니다: D-2-2 학사 D-2-1은 전문학사",
          "citations": [
            "EV-DEV-003-A"
          ]
        },
        "is_official_gold": false
      },
      {
        "item_id": "ARTEMIS-004-DEV-004",
        "overall_passed": true,
        "primary_outcome": "correct",
        "dimension_scores": {
          "source_fidelity": {
            "dimension": "source_fidelity",
            "outcome": "correct",
            "passed": true,
            "failures": [],
            "details": {}
          },
          "citation_accuracy": {
            "dimension": "citation_accuracy",
            "outcome": "correct",
            "passed": true,
            "failures": [],
            "details": {
              "metric_scope": "citation_id_overlap_only",
              "precision": 1.0,
              "recall": 1.0,
              "citations": [
                "EV-DEV-004-A"
              ]
            }
          },
          "procedural_integrity": {
            "dimension": "procedural_integrity",
            "outcome": "correct",
            "passed": true,
            "failures": [],
            "details": {}
          },
          "abstention_appropriateness": {
            "dimension": "abstention_appropriateness",
            "outcome": "correct",
            "passed": true,
            "failures": [],
            "details": {
              "status": "answered",
              "should_withhold": false,
              "forbid_withholding": true
            }
          }
        },
        "all_failures": [],
        "flags": [
          "pending_human_review",
          "candidate_evaluation_only"
        ],
        "parsed_response": {
          "status": "answered",
          "answer": "공식 지침 및 출입국관리법령에 따른 안내입니다: E-7-4 숙련기능인력 E-7-1은 전문인력",
          "citations": [
            "EV-DEV-004-A"
          ]
        },
        "is_official_gold": false
      },
      {
        "item_id": "ARTEMIS-004-DEV-005",
        "overall_passed": true,
        "primary_outcome": "correct",
        "dimension_scores": {
          "source_fidelity": {
            "dimension": "source_fidelity",
            "outcome": "correct",
            "passed": true,
            "failures": [],
            "details": {}
          },
          "citation_accuracy": {
            "dimension": "citation_accuracy",
            "outcome": "correct",
            "passed": true,
            "failures": [],
            "details": {
              "metric_scope": "citation_id_overlap_only",
              "precision": 1.0,
              "recall": 1.0,
              "citations": [
                "EV-DEV-005-A"
              ]
            }
          },
          "procedural_integrity": {
            "dimension": "procedural_integrity",
            "outcome": "correct",
            "passed": true,
            "failures": [],
            "details": {}
          },
          "abstention_appropriateness": {
            "dimension": "abstention_appropriateness",
            "outcome": "correct",
            "passed": true,
            "failures": [],
            "details": {
              "status": "answered",
              "should_withhold": false,
              "forbid_withholding": true
            }
          }
        },
        "all_failures": [],
        "flags": [
          "pending_human_review",
          "candidate_evaluation_only"
        ],
        "parsed_response": {
          "status": "answered",
          "answer": "공식 지침 및 출입국관리법령에 따른 안내입니다: 60,000원 30,000원",
          "citations": [
            "EV-DEV-005-A"
          ]
        },
        "is_official_gold": false
      },
      {